{
  "$schema": "https://json-schema.org/draft/2020-12/schema",
  "type": "object",
  "additionalProperties": false,
  "required": ["submissionId", "deviceId", "requestHash", "events"],
  "properties": {
    "submissionId": { "type": "string", "format": "uuid" },
    "deviceId": { "type": "string", "format": "uuid" },
    "requestHash": { "type": "string", "pattern": "^[0-9a-f]{64}$" },
    "events": {
      "type": "array",
      "minItems": 1,
      "maxItems": 25,
      "items": { "$ref": "./purchase_registered.schema.json" }
    }
  }
}
