{
  "deviceId": "22222222-2222-4222-8222-222222222222",
  "events": [
    {
      "accountId": "11111111-1111-4111-8111-111111111111",
      "contentHash": "2c65e7beafe73f1df5b6d48cbeaeab945efb2847108c2bece82e4a7db41e1906",
      "deviceId": "22222222-2222-4222-8222-222222222222",
      "deviceSequence": 1,
      "eventId": "33333333-3333-4333-8333-333333333333",
      "eventType": "purchase.registered",
      "occurrenceTime": "2026-07-14T12:00:00.000Z",
      "payload": { "purchase": { "id": "44444444-4444-4444-8444-444444444444", "accountId": "11111111-1111-4111-8111-111111111111", "store": {}, "occurrenceTime": "2026-07-14T12:00:00.000Z", "currencyCode": "BRL", "totalMinorUnits": 1299, "items": [{}] } },
      "payloadVersion": 3
    }
  ],
  "requestHash": "491d2f49525cb5094134f8e2cfb90c86723f9d7bc2f9eb14ddb62dbd3bda5f9c",
  "submissionId": "88888888-8888-4888-8888-888888888888"
}
